Section,Change Type,Current State,Requested Change
"Services (""How I Can Help You"")",Content / Layout,"Subheader reads: ""My coaching services are built upon real-world experience and practical steps.""",Remove the subheader entirely.
"Services (""How I Can Help You"")",Content / Typography,"Service card titles have mixed capitalization (e.g., ""Preparing for interviews"" vs ""Navigating Delicate Scenarios"").","Ensure all four service card headers are consistently Sentence case (e.g., change ""Navigating Delicate Scenarios"" to ""Navigating delicate scenarios"")."
Why Work With Me?,Content,"The description in the 2nd card (""Proven industry experience"") mentions ""16 years,"" which is repetitive.","Remove the specific ""16 years"" reference from the card description to avoid repetition with the intro section."
Why Work With Me?,Typography,Headers for the 3 cards may have mixed capitalization.,"Ensure the headers for all 3 cards are consistently Sentence case (e.g., ""Proven industry experience"")."
"Contact (""Get In Touch"")",Functionality,The contact form submission is not working.,"Fix form functionality. Configure the backend/mailer to send all form submissions to careerstudio@jillianrodak.com. Ensure that there is a ""successful submission"" message that appears on screen and that the notification email sent to careerstudio@jillianrodak.com, contains the captured form information in a coherent format."